book_id,title,author,narrator,genre,duration,description,tags,rating,average_rating,total_ratings,duration_hours,release_date
195,Gentle Time,William Williams,Olivia Gonzalez,Science Fiction,594,'Gentle Time' is a brilliant science fiction work that highlights William Williams's exceptional storytelling abilities.,"educational, bestseller, contemporary, romantic",5.0,4.8,950,10.0,2023-03-20
196,Sacred Sun Memory,Sophia Anderson,Daniel Williams,Mystery,860,"In this uplifting mystery masterpiece, Sophia Anderson creates a compelling narrative that will keep you hooked until the last page.","uplifting, thought-provoking, atmospheric",3.0,4.0,600,6.5,2023-05-05
197,Gentle Journey,James Jones,Amelia Smith,Self-Help,882,"A captivating self-help novel by James Jones, 'Gentle Journey' investigates the complex world of personal growth.","educational, philosophical, complex-plot, character-driven",4.2,4.8,950,10.0,2023-03-20
198,Mysterious Mountain Light,Mia Rodriguez,Benjamin Moore,Self-Help,222,"A captivating self-help novel by Mia Rodriguez, 'Mysterious Mountain Light' delves into the complex world of human relationships.","page-turner, dark",3.0,4.0,600,6.5,2023-05-05
199,Dark World City,John Hernandez,David Martin,Romance,286,"In this suspenseful romance masterpiece, John Hernandez creates a spellbinding narrative that will keep you hooked until the last page.","emotional, page-turner, dark, suspenseful",4.0,4.8,950,10.0,2023-03-20
200,Lost Sun,Olivia Smith,Sophia Hernandez,Literary Fiction,660,"A captivating literary fiction novel by Olivia Smith, 'Lost Sun' investigates the fascinating world of adventure.","award-winning, classic, thought-provoking, complex-plot, bestseller",4.1,4.8,950,10.0,2023-03-20
